{
  "$schema": "http://json-schema.org/draft-07/schema#",
  "title": "CORE Agent Task v1",
  "description": "Schema for a domain-neutral agent task describing what an agent intends to do. CORE validates structure; downstream forks interpret intent and slots.",
  "type": "object",
  "required": ["schema_version", "type", "task_id", "intent", "slots", "safety"],
  "additionalProperties": false,
  "properties": {
    "schema_version": {
      "type": "string",
      "const": "core.agent_task.v1",
      "description": "Schema version identifier."
    },
    "type": {
      "type": "string",
      "const": "agent_task",
      "description": "Artifact type."
    },
    "task_id": {
      "type": "string",
      "minLength": 1,
      "pattern": "^agent_task:[a-z0-9_:.-]+$",
      "description": "Unique task identifier. Format: agent_task:<domain-specific-id>."
    },
    "intent": {
      "type": "string",
      "minLength": 1,
      "description": "Natural-language description of the task intent."
    },
    "slots": {
      "type": "object",
      "additionalProperties": true,
      "description": "Key-value pairs for structured task parameters."
    },
    "vocabulary_id": {
      "type": "string",
      "minLength": 1,
      "description": "Optional vocabulary domain identifier for domain-specific interpretation."
    },
    "classification_candidate_ref": {
      "type": "string",
      "description": "Optional reference to a classification_candidate that produced this task."
    },
    "safety": {
      "type": "object",
      "required": ["requires_command_validation"],
      "additionalProperties": false,
      "properties": {
        "requires_command_validation": {
          "type": "boolean",
          "description": "Whether command validation is required. Must be true."
        },
        "forbidden_patterns": {
          "type": "array",
          "items": {"type": "string"},
          "description": "Patterns that must not appear in task execution."
        }
      }
    },
    "provenance": {
      "type": "object",
      "required": ["source"],
      "additionalProperties": false,
      "properties": {
        "source": {
          "type": "string",
          "enum": [
            "human_input",
            "scheduled_task",
            "watcher_trigger",
            "expert_proposal"
          ],
          "description": "Origin of the task."
        },
        "trigger_fingerprint": {
          "type": "string",
          "pattern": "^sha256:[a-f0-9]{64}$",
          "description": "Optional SHA-256 fingerprint of the triggering event."
        }
      }
    }
  }
}
